{
  "event_id": "sample",
  "timestamp": "2026-01-01T00:00:00Z",
  "schema_id": "https://example.com/x",
  "schema_version": "sample",
  "direction": "input",
  "source": "x",
  "target": "x",
  "violations": [
    {
      "path": "sample",
      "keyword": "sample",
      "message": "sample"
    }
  ],
  "payload_hash": "sha256:aaaaaaaaaaaaaaaaaaaaaaaaaaaaaaaaaaaaaaaaaaaaaaaaaaaaaaaaaaaaaaaa",
  "payload_size": 0,
  "severity": "warn"
}